<?xml version="1.0" encoding="UTF-8"?>
<tns:estudiantes xmlns:tns="http://www.example.org/NewXMLSchema" xmlns:xsi="http://www.w3.org/2001/XMLSchema-instance" xsi:schemaLocation="http://www.example.org/NewXMLSchema NewXMLSchema.xsd ">
  <tns:estudiante>
    <tns:Codigo>tns:Codigo</tns:Codigo>
    <tns:Nombre>tns:Nombre</tns:Nombre>
    <tns:Semestre>
      <tns:Numero>tns:Numero</tns:Numero>
      <tns:curso>
        <tns:Nombre>tns:Nombre</tns:Nombre>
        <tns:Codigo>tns:Codigo</tns:Codigo>
        <tns:Nota_1>0.0</tns:Nota_1>
        <tns:Nota_2>0.0</tns:Nota_2>
        <tns:Nota_3>0.0</tns:Nota_3>
        <tns:Nota_Final>0.0</tns:Nota_Final>
      </tns:curso>
    </tns:Semestre>
  </tns:estudiante>
  <tns:estudiante>
    <tns:Codigo>tns:Codigo</tns:Codigo>
    <tns:Nombre>tns:Nombre</tns:Nombre>
    <tns:Semestre>
      <tns:Numero>tns:Numero</tns:Numero>
      <tns:curso>
        <tns:Nombre>tns:Nombre</tns:Nombre>
        <tns:Codigo>tns:Codigo</tns:Codigo>
        <tns:Nota_1>0.0</tns:Nota_1>
        <tns:Nota_2>0.0</tns:Nota_2>
        <tns:Nota_3>0.0</tns:Nota_3>
        <tns:Nota_Final>0.0</tns:Nota_Final>
      </tns:curso>
    </tns:Semestre>
  </tns:estudiante>
  <tns:estudiante>
    <tns:Codigo>tns:Codigo</tns:Codigo>
    <tns:Nombre>tns:Nombre</tns:Nombre>
    <tns:Semestre>
      <tns:Numero>tns:Numero</tns:Numero>
      <tns:curso>
        <tns:Nombre>tns:Nombre</tns:Nombre>
        <tns:Codigo>tns:Codigo</tns:Codigo>
        <tns:Nota_1>0.0</tns:Nota_1>
        <tns:Nota_2>0.0</tns:Nota_2>
        <tns:Nota_3>0.0</tns:Nota_3>
        <tns:Nota_Final>0.0</tns:Nota_Final>
      </tns:curso>
    </tns:Semestre>
  </tns:estudiante>
  <tns:estudiante>
    <tns:Codigo>tns:Codigo</tns:Codigo>
    <tns:Nombre>tns:Nombre</tns:Nombre>
    <tns:Semestre>
      <tns:Numero>tns:Numero</tns:Numero>
      <tns:curso>
        <tns:Nombre>tns:Nombre</tns:Nombre>
        <tns:Codigo>tns:Codigo</tns:Codigo>
        <tns:Nota_1>0.0</tns:Nota_1>
        <tns:Nota_2>0.0</tns:Nota_2>
        <tns:Nota_3>0.0</tns:Nota_3>
        <tns:Nota_Final>0.0</tns:Nota_Final>
      </tns:curso>
    </tns:Semestre>
  </tns:estudiante>
  <tns:estudiante>
    <tns:Codigo>tns:Codigo</tns:Codigo>
    <tns:Nombre>tns:Nombre</tns:Nombre>
    <tns:Semestre>
      <tns:Numero>tns:Numero</tns:Numero>
      <tns:curso>
        <tns:Nombre>tns:Nombre</tns:Nombre>
        <tns:Codigo>tns:Codigo</tns:Codigo>
        <tns:Nota_1>0.0</tns:Nota_1>
        <tns:Nota_2>0.0</tns:Nota_2>
        <tns:Nota_3>0.0</tns:Nota_3>
        <tns:Nota_Final>0.0</tns:Nota_Final>
      </tns:curso>
    </tns:Semestre>
  </tns:estudiante>
  <tns:estudiante>
    <tns:Codigo>tns:Codigo</tns:Codigo>
    <tns:Nombre>tns:Nombre</tns:Nombre>
    <tns:Semestre>
      <tns:Numero>tns:Numero</tns:Numero>
      <tns:curso>
        <tns:Nombre>tns:Nombre</tns:Nombre>
        <tns:Codigo>tns:Codigo</tns:Codigo>
        <tns:Nota_1>0.0</tns:Nota_1>
        <tns:Nota_2>0.0</tns:Nota_2>
        <tns:Nota_3>0.0</tns:Nota_3>
        <tns:Nota_Final>0.0</tns:Nota_Final>
      </tns:curso>
    </tns:Semestre>
  </tns:estudiante>
  <tns:estudiante>
    <tns:Codigo>tns:Codigo</tns:Codigo>
    <tns:Nombre>tns:Nombre</tns:Nombre>
    <tns:Semestre>
      <tns:Numero>tns:Numero</tns:Numero>
      <tns:curso>
        <tns:Nombre>tns:Nombre</tns:Nombre>
        <tns:Codigo>tns:Codigo</tns:Codigo>
        <tns:Nota_1>0.0</tns:Nota_1>
        <tns:Nota_2>0.0</tns:Nota_2>
        <tns:Nota_3>0.0</tns:Nota_3>
        <tns:Nota_Final>0.0</tns:Nota_Final>
      </tns:curso>
    </tns:Semestre>
  </tns:estudiante>
  <tns:estudiante>
    <tns:Codigo>tns:Codigo</tns:Codigo>
    <tns:Nombre>tns:Nombre</tns:Nombre>
    <tns:Semestre>
      <tns:Numero>tns:Numero</tns:Numero>
      <tns:curso>
        <tns:Nombre>tns:Nombre</tns:Nombre>
        <tns:Codigo>tns:Codigo</tns:Codigo>
        <tns:Nota_1>0.0</tns:Nota_1>
        <tns:Nota_2>0.0</tns:Nota_2>
        <tns:Nota_3>0.0</tns:Nota_3>
        <tns:Nota_Final>0.0</tns:Nota_Final>
      </tns:curso>
    </tns:Semestre>
  </tns:estudiante>
  <tns:estudiante>
    <tns:Codigo>tns:Codigo</tns:Codigo>
    <tns:Nombre>tns:Nombre</tns:Nombre>
    <tns:Semestre>
      <tns:Numero>tns:Numero</tns:Numero>
      <tns:curso>
        <tns:Nombre>tns:Nombre</tns:Nombre>
        <tns:Codigo>tns:Codigo</tns:Codigo>
        <tns:Nota_1>0.0</tns:Nota_1>
        <tns:Nota_2>0.0</tns:Nota_2>
        <tns:Nota_3>0.0</tns:Nota_3>
        <tns:Nota_Final>0.0</tns:Nota_Final>
      </tns:curso>
    </tns:Semestre>
  </tns:estudiante>
  <tns:estudiante>
    <tns:Codigo>tns:Codigo</tns:Codigo>
    <tns:Nombre>tns:Nombre</tns:Nombre>
    <tns:Semestre>
      <tns:Numero>tns:Numero</tns:Numero>
      <tns:curso>
        <tns:Nombre>tns:Nombre</tns:Nombre>
        <tns:Codigo>tns:Codigo</tns:Codigo>
        <tns:Nota_1>0.0</tns:Nota_1>
        <tns:Nota_2>0.0</tns:Nota_2>
        <tns:Nota_3>0.0</tns:Nota_3>
        <tns:Nota_Final>0.0</tns:Nota_Final>
      </tns:curso>
    </tns:Semestre>
  </tns:estudiante>
  <tns:estudiante>
    <tns:Codigo>tns:Codigo</tns:Codigo>
    <tns:Nombre>tns:Nombre</tns:Nombre>
    <tns:Semestre>
      <tns:Numero>tns:Numero</tns:Numero>
      <tns:curso>
        <tns:Nombre>tns:Nombre</tns:Nombre>
        <tns:Codigo>tns:Codigo</tns:Codigo>
        <tns:Nota_1>0.0</tns:Nota_1>
        <tns:Nota_2>0.0</tns:Nota_2>
        <tns:Nota_3>0.0</tns:Nota_3>
        <tns:Nota_Final>0.0</tns:Nota_Final>
      </tns:curso>
    </tns:Semestre>
  </tns:estudiante>
</tns:estudiantes>
